
B319 SEARS LA PAZ CENTRO,AV 16 DE SEPTIEMBRE 111 ZN,LA PAZ,,23000,MX
CRUZ PEREZ GLADYS ROCIO,BLVD CONSTITUYENTES 133 INT 4,LA PAZ,,23094,MX
TAMAYO VELAZQUEZ JAVIER ANTONIO,ALTAMIRANO No. 407,LA PAZ,,23000,MX
EM: SUC. LA PAZ - ISIDRO VALDEZ MAD,I. ALTAMIRANO S/N,LA PAZ,,23000,MX
EM: VALDEZ RAMIREZ RODOLFO,ALTAMIRANO S/N,LA PAZ,,23000,MX
EM: POLANCO SALGADO ABRAHAM,CALLE PINEDA NO. 776,LA PAZ,,23000,MX
EM: VALDEZ GONZALEZ JESUS MARCELINO,BRAVO 918,LA PAZ,,23000,MX
A919 PUNTO LA PAZ,BLVD CONSTITUYENTES DE SCM 54,LA PAZ,,23090,MX
B316 SEARS LA PAZ FORJADORES,BLVD FORJADORES DE SUBCALIFORNIA,LA PAZ,,23050,MX
B798 PASEO LAPAZ,BLVD AGUSTIN OLACHEA AVILES 1515,LA PAZ,,23090,MX
A872 SORIANA FORJADORES APERTURA,BLVD FORJADORES SN  LOC 3,LA PAZ,,23050,MX
1012 LA PAZ,BLVD FORJADORES 4010,LA PAZ,,23050,MX
SERRANO CASTRO IRENE,AV. FORJADORES DE SUDCALIFORNIA,LA PAZ,,23050,MX
VALDEZ RAMIREZ RODOLFO,LA MONTURA 208,LA PAZ,,23088,MX
TAMAYO VELAZQUEZ JAVIER ANTONIO,ALTAMIRANO No. 407,LA PAZ,,23000,MX
EM: POLANCO SALGADO ABRAHAM,CALLE PINEDA NO. 776,LA PAZ,,23000,MX
EM: VALDEZ GONZALEZ JESUS MARCELINO,BRAVO 918,LA PAZ,,23000,MX
B319 SEARS LA PAZ CENTRO,AV 16 DE SEPTIEMBRE 111 ZN,LA PAZ,,23000,MX
EM: VALDEZ RAMIREZ RODOLFO,ALTAMIRANO S/N,LA PAZ,,23000,MX
EM: SUC. LA PAZ - ISIDRO VALDEZ MAD,I. ALTAMIRANO S/N,LA PAZ,,23000,MX
SERRANO CASTRO IRENE,AV. FORJADORES DE SUDCALIFORNIA,LA PAZ,,23050,MX
A872 SORIANA FORJADORES APERTURA,BLVD FORJADORES SN  LOC 3,LA PAZ,,23050,MX
1012 LA PAZ,BLVD FORJADORES 4010,LA PAZ,,23050,MX
CRUZ PEREZ GLADYS ROCIO,BLVD CONSTITUYENTES 133 INT 4,LA PAZ,,23094,MX
B798 PASEO LAPAZ,BLVD AGUSTIN OLACHEA AVILES 1515,LA PAZ,,23090,MX
B316 SEARS LA PAZ FORJADORES,BLVD FORJADORES DE SUBCALIFORNIA,LA PAZ,,23050,MX
A919 PUNTO LA PAZ,BLVD CONSTITUYENTES DE SCM 54,LA PAZ,,23090,MX
VALDEZ RAMIREZ RODOLFO,LA MONTURA 208,LA PAZ,,23088,MX
EM: 2 - LIZARRAGA OSUNA SUSANA,EL DORADO 924,CULIACAN,,80060,MX
FELIX RUBIO DINA,MIGUEL HIDALGO OTE 74,CULIACAN,,80000,MX
NEVAREZ GUTIERREZ BRISEIDA,INDEPENDENCIA 243,CULIACAN,,80430,MX
B794 DEVLYN PLAZA BARRANCOS,AV ALMA SHILLER DE Z 4320,CULIACAN,,80189,MX
B871 EXPLANADA CULIACAN,BLVD JESUS KUMATE R 5388,CULIACAN,,80104,MX
B484 WALMART MEXICO 68 CULIACAN,AV GENERAL ALVARO OBREGON 2891,CULIACAN,,80227,MX
B287 SEARS CULIACAN,BLVD ALVARO OBREGON SUR 1980,CULIACAN,,80228,MX
EM: MARTINEZ MARTINEZ JESUS,MIGUEL HIDALGO OTE 32,CULIACAN,,80170,MX
MONARREZ FELIX IRMA,AV. ALVARO OBREGON No. 1880,CULIACAN,,80228,MX
ESQUIVEL GARCIA LUIS FELIPE,JUAN DE DIOS BATIZ 139,CULIACAN,,80220,MX
B933 CIMACO CULIACAN,BLVD PEDRO INFANTE 3000,CULIACAN,,80100,MX
ZAZUETA MEDINA HERIBERTO,AV. ALVARO OBREGON No. 1106,CULIACAN,,80220,MX
VARGAS BONILLA JUAN,JESUS G ANDRADE No. 501 INT 2,CULIACAN,,80200,MX
A723 CULIACAN PLAZA FIESTA,AV INSURGENTES Y L. CARDENAS SN,CULIACAN ROSALES,,80200,MX
"ASOCIACION OPTIKA GHC, SA DE CV",AV DONATO GUERRA 580 SUR,CULIACAN,,80200,MX
PERDOMO SIERRA MICHELLE MARIANA,AQUILES SERDAN 63 SUR,"COL CENTRO, CULIACAN",,80000,MX
CASTRO ROMO FLERIDA DRUCILA,CRISTOBAL COLON PTE No. 274,CULIACAN,,80000,MX
BARRON MONTES JESUS OLIVIA,MARIANO ESCOBEDO OTE  No. 234,CULIACAN,,80000,MX
EM: OPERADORA PARA LAS MEJORES OPT,ESCOBEDO No. 258,CULIACAN,,80000,MX
CARLON RODRIGO DANIEL,MIGUEL HIDALGO 287 INT 22,CULIACAN,,80000,MX
ALMANZA CASTILLO ARTURO RAFAEL,HIDALGO ORIENTE No. 181,CULIACAN,,80000,MX
A978 CULIACAN CENTRO,AV. ANTONIO ROSALES 216,CULIACAN ROSALES,,80000,MX
CAMARENA LEDESMA MARCELA DE LOS,BLVD SINALOA No. 716 A,CULIACAN,,80060,MX
0046 L CULIACAN,BLVD. JOSE DIEGO VALADEZ 1676,PONIENTE COL. DESARROLLO URBANO,,80000,MX
A750 FORUM CULIACAN,BLVD JOSE DIEGO VALADES 1676 PB07,CULIACAN ROSALES,,80027,MX
"GRUPO MISOCRI, SA DE CV",BLVD. JOSE DIEGO VALADEZ No. 1676,CULIACAN,,80020,MX
B298 SEARS FORUM CULIACAN,BLVD DIEGO VALADEZ RIOS 1676,CULIACAN,,80027,MX
A833 CULIACAN LA CAMPINA,BLVD DR MORA 1725 LOC 6-G,CULIACAN ROSALES,,80060,MX
EM: SUC. 81 SUNCITY FORUM CULIACAN,BLVD. JOSE DIEGO V. No. 1676,CULIACAN,,80020,MX
B727 SENDERO CULIACAN,JOSE LIMON CALZADA 2545 LOC 10,CULIACAN,,80020,MX
LOPEZ MORENO BEATRIZ ARMIDA,MIGUEL HIDALGO No. 266 OTE,CULIACAN DE ROSALES,,80000,MX
1023 CULIACAN,BLVD ENRIQUE SANCHEZ ALONSO 435,CULIACAN,,80027,MX
FELIX RUBIO DINA,MIGUEL HIDALGO OTE 74,CULIACAN,,80000,MX
EM: 2 - LIZARRAGA OSUNA SUSANA,EL DORADO 924,CULIACAN,,80060,MX
GONZALEZ CORREA JUAN IGNACIO,AQUILES SERDAN 954 INT 104,DURANGO,,34000,MX
SOTO GALLEGOS MARIA EUFROCINA,BRUNO MARTINEZ No. 144 SUR,DURANGO,,34000,MX
GALLARDO OLGUIN MARIA DEL RAYO,HIDALGO No. 303 SUR,DURANGO,,34000,MX
B295 SEARS CENTRO DURANGO,CONSTITUCION 163,DURANGO,,34000,MX
RODRIGUEZ PIEDRA HERIBERTO,CONSTITUCION SUR 206,DURANGO,,34000,MX
ANZA OPTICOS S.A. DE C.V.,PATONI 121 NTE,DURANGO,,34000,MX
EM: BORREGO NUNEZ GRACIELA,AV 20 NOVIEMBRE PTE No 203A,DURANGO,,34000,MX
B293 SEARS PASEO DURANGO,AV FELIPE PESCADOR 1401,DURANGO,,34080,MX
LUJAN SERRANO ROBERTO,JUAREZ 201-B SUR,DURANGO,,34000,MX
A770 PASEO DURANGO,BLVD FELIPE PESCADOR 1401,COL PRIVADA DEL SAHUARO,,34000,MX
BORREGO NUNEZ GRACIELA,BLVD. FELIPE PESCADOR No. 1401,DURANGO,,34080,MX
ANDRADE AVALOS JUAN CARLOS,AV. 5 DE FEBRERO No. 114 OTE,DURANGO,,34000,MX
GONZALEZ CEDILLO HAZEL,RIO PANUCO 200,DURANGO,,34120,MX
EM: RIOPEDRE ZARAGOZA JORGE ALONSO,CARLOS LEON DE LA PENA 414-A,DURANGO,,34000,MX
ANDRADE ZAMORA JESUS LUIS,DIEGO DE IBARRA LOC. 25 C,DURANGO,,34080,MX
ANDRADE ZAMORA LORENZO IVAN,CAPITAN FRANCISCO DE IBARRA,DURANGO,,34080,MX
1015 DURANGO,AV HEROICO COLEGIO MILITAR 109,DURANGO,,34080,MX
DE AVILA MARTINEZ ROCIO,CALLE VICTORIA 503 C SUR,DURANGO,,34000,MX
EM: SUC. 15 DURANGO (DGO) -,AV JUAREZ No. 311,DURANGO,,34000,MX
ENRIQUEZ LOMBARD CLAUDIA DE LOURDES,JUAREZ 410,DURANGO,,34000,MX
1015 DURANGO,AV HEROICO COLEGIO MILITAR 109,DURANGO,,34080,MX
EM: SUC. 15 DURANGO (DGO) -,AV JUAREZ No. 311,DURANGO,,34000,MX
A770 PASEO DURANGO,BLVD FELIPE PESCADOR 1401,COL PRIVADA DEL SAHUARO,,34000,MX
BORREGO NUNEZ GRACIELA,BLVD. FELIPE PESCADOR No. 1401,DURANGO,,34080,MX
B293 SEARS PASEO DURANGO,AV FELIPE PESCADOR 1401,DURANGO,,34080,MX
ANDRADE ZAMORA LORENZO IVAN,CAPITAN FRANCISCO DE IBARRA,DURANGO,,34080,MX
ENRIQUEZ LOMBARD CLAUDIA DE LOURDES,JUAREZ 410,DURANGO,,34000,MX
ANDRADE ZAMORA JESUS LUIS,DIEGO DE IBARRA LOC. 25 C,DURANGO,,34080,MX
LUJAN SERRANO ROBERTO,JUAREZ 201-B SUR,DURANGO,,34000,MX
ANDRADE AVALOS JUAN CARLOS,AV. 5 DE FEBRERO No. 114 OTE,DURANGO,,34000,MX
EM: RIOPEDRE ZARAGOZA JORGE ALONSO,CARLOS LEON DE LA PENA 414-A,DURANGO,,34000,MX
ANZA OPTICOS S.A. DE C.V.,PATONI 121 NTE,DURANGO,,34000,MX
EM: BORREGO NUNEZ GRACIELA,AV 20 NOVIEMBRE PTE No 203A,DURANGO,,34000,MX
B295 SEARS CENTRO DURANGO,CONSTITUCION 163,DURANGO,,34000,MX
RODRIGUEZ PIEDRA HERIBERTO,CONSTITUCION SUR 206,DURANGO,,34000,MX
SOTO GALLEGOS MARIA EUFROCINA,BRUNO MARTINEZ No. 144 SUR,DURANGO,,34000,MX
GONZALEZ CORREA JUAN IGNACIO,AQUILES SERDAN 954 INT 104,DURANGO,,34000,MX
GALLARDO OLGUIN MARIA DEL RAYO,HIDALGO No. 303 SUR,DURANGO,,34000,MX
GONZALEZ CEDILLO HAZEL,RIO PANUCO 200,DURANGO,,34120,MX
DE AVILA MARTINEZ ROCIO,CALLE VICTORIA 503 C SUR,DURANGO,,34000,MX
A620 COPPEL LINARES,AV HIDALGO 960,LINARES,,67700,MX
A598 COPPEL HIDALGO (LINARES),AV DR CARLOS GARCIA RODRIGUEZ 505,LINARES,,67700,MX
B838 PLAZA CAMPESTRE CD VICTORIA,BLVD TAMAULIPAS 3262 LOC 7,TAMAULIPAS,,87027,MX
TAMAYO RODRIGUEZ CLAUDIA ANGELICA,AV. DEL VALLE 1126 LOC 3,VICTORIA,,87029,MX
A596 COPPEL LAS ADELITAS,JESUS ELIAS PINA 24,VICTORIA,,87049,MX
B887 SORIANA CD VICTORIA,JUAN B TIJERINA 2033 LOC 12E,CD VICTORIA,,87140,MX
JARAMILLO TURRUBIATES JUAN JOSE,AV ALBERTO CARRERA TORRES 510-A,VICTORIA,,87000,MX
EM: BRIONES RODRIGUEZ PAULA ISELA,MIGUEL HIDALGO 427,CIUDAD VICTORIA,,87090,MX
A683 COPPEL MORELOS CD VICTORIA,JOSE MARIA MORELOS 1001,VICTORIA,,87000,MX
EM: TAMAYO RODRIGUEZ CLAUDIA,BENITO JUAREZ 538 OTE,VICTORIA,,87000,MX
OPTICAS DE MEXICO CENTRO DE,BENITO JUAREZ No. 538,VICTORIA,,87000,MX
EM: TAMAYO RODRIGUEZ CLAUDIA,BENITO JUAREZ 538 OTE,VICTORIA,,87000,MX
OPTICAS DE MEXICO CENTRO DE,BENITO JUAREZ No. 538,VICTORIA,,87000,MX
KEY WEST OPTICAL,1444 KENNEDY DR,KEY WEST,FL,33040-4008,US
OPPENHEIMER EYE CLINIC PLLC,3306 N ROOSEVELT BLVD,KEY WEST,FL,33040,US
KEY WEST OPTICAL,1444 KENNEDY DR,KEY WEST,FL,33040-4008,US
OPPENHEIMER EYE CLINIC PLLC,3306 N ROOSEVELT BLVD,KEY WEST,FL,33040,US
BAHAMAS VISION CENTRE,PO BOX N 386,NASSAU,,9,BS
EM: SUC PLAZA LOS MOCHIS -OPERADORA,GUILLERMO PRIETO No. 459 LOCAL B,AHOME,,81200,MX
A905 PASEO LOS MOCHIS,BLVD CENTENARIO 805 LOC A-2,AHOME,,81200,MX
A960 LOS MOCHIS PLAZA FIESTA,BLVD ANTONIO ROSALES LOC 1,AHOME LOS MOCHIS,,81200,MX
B311 SEARS LOS MOCHIS,BLVD CENTENARIO 805 LOC A-2,AHOME,,81271,MX
0305 L LOS MOCHIS,BLVD. CENTENARIO No. 805 PTE,ESQ ANTONIO ROSALES,,81270,MX
ACOSTA NAVARRO ROMINA PAOLA,GABRIEL LEYVA SUR No. 160,AHOME,,81200,MX
B004 LOS MOCHIS CENTRO,AV INDEPENDENCIA 385,AHOME,,81200,MX
OPTICA GARCIA S.A.DE C.V,GABRIEL LEYVA No. 198 SUR,AHOME,,81200,MX
LEDESMA MELECIO ZARHAEMLA,ALVARO OBREGON PTE No. 1431-A,AHOME,,81245,MX
EM: SUC. PLAZA CIUDAD OBREGON,NO REELECCION No. 826,AHOME,,81200,MX
B493 CASA LEY GUASAVE,AV ARTURO PEIBERT CAMACH SN,GUASAVE,,81040,MX
MANJARREZ VARELA LINA MARGARITA,SERAPIO RENDON No. 561 PTE.,AHOME,,81200,MX
VARELA SARABIA MONICA,RODOLFO T.LOAIZA No. 610-210,AHOME,,81220,MX
LOPEZ ZENDEJAS LUZ DEL CARMEN,CARRASCO SN,GUASAVE,,81000,MX
EM: LUGO GARCIA CARMEN MARIA,CUAUHTEMOC No. 38,GUASAVE,,81000,MX
EM: AHUMADA CHAVEZ CARMEN ZAMIRA,JUAN CARRASCO 461,GUASAVE,,81000,MX
B882 WALMART GUASAVE,AV PASEO MIGUEL LEYSON PEREZ,GUASAVE,,81020,MX
B728 SENDERO LOS MOCHIS,BLVD ANTONIO ROSALES 2300 LOC D3,AHOME,,81210,MX
ROCHA BELTRAN GILBERTO,BENITO JUAREZ No. 338 PTE,AHOME,,81200,MX
B030 GUAMUCHIL PLAZA EVORA,BLVD ANTONIO ROSALES SN LOC 12,SALVADOR ALVARDO GUAMUCHIL,,81460,MX
RICHARD INZUNZA MARIA DE JESUS,BLVD GRAL ANTONIO ROSALES 255,GUAMUCHIL,,81400,MX
EM: LUGO GARCIA CARMEN MARIA,CUAUHTEMOC No. 38,GUASAVE,,81000,MX
LOPEZ ZENDEJAS LUZ DEL CARMEN,CARRASCO SN,GUASAVE,,81000,MX
EM: AHUMADA CHAVEZ CARMEN ZAMIRA,JUAN CARRASCO 461,GUASAVE,,81000,MX
B493 CASA LEY GUASAVE,AV ARTURO PEIBERT CAMACH SN,GUASAVE,,81040,MX
B882 WALMART GUASAVE,AV PASEO MIGUEL LEYSON PEREZ,GUASAVE,,81020,MX
1145 CULIACAN,BLVD. CARLOS SALINAS DE GORTARI,No. 1676 PTE. FRACCIONAMIENTO,,80000,MX
1023 CULIACAN,BLVD ENRIQUE SANCHEZ ALONSO 435,CULIACAN,,80027,MX
LOPEZ MORENO BEATRIZ ARMIDA,MIGUEL HIDALGO No. 266 OTE,CULIACAN DE ROSALES,,80000,MX
B727 SENDERO CULIACAN,JOSE LIMON CALZADA 2545 LOC 10,CULIACAN,,80020,MX
EM: SUC. 81 SUNCITY FORUM CULIACAN,BLVD. JOSE DIEGO V. No. 1676,CULIACAN,,80020,MX
A833 CULIACAN LA CAMPINA,BLVD DR MORA 1725 LOC 6-G,CULIACAN ROSALES,,80060,MX
A750 FORUM CULIACAN,BLVD JOSE DIEGO VALADES 1676 PB07,CULIACAN ROSALES,,80027,MX
B298 SEARS FORUM CULIACAN,BLVD DIEGO VALADEZ RIOS 1676,CULIACAN,,80027,MX
0046 L CULIACAN,BLVD. JOSE DIEGO VALADEZ 1676,PONIENTE COL. DESARROLLO URBANO,,80000,MX
"GRUPO MISOCRI, SA DE CV",BLVD. JOSE DIEGO VALADEZ No. 1676,CULIACAN,,80020,MX
CAMARENA LEDESMA MARCELA DE LOS,BLVD SINALOA No. 716 A,CULIACAN,,80060,MX
A978 CULIACAN CENTRO,AV. ANTONIO ROSALES 216,CULIACAN ROSALES,,80000,MX
ALMANZA CASTILLO ARTURO RAFAEL,HIDALGO ORIENTE No. 181,CULIACAN,,80000,MX
CARLON RODRIGO DANIEL,MIGUEL HIDALGO 287 INT 22,CULIACAN,,80000,MX
EM: OPERADORA PARA LAS MEJORES OPT,ESCOBEDO No. 258,CULIACAN,,80000,MX
BARRON MONTES JESUS OLIVIA,MARIANO ESCOBEDO OTE  No. 234,CULIACAN,,80000,MX
CASTRO ROMO FLERIDA DRUCILA,CRISTOBAL COLON PTE No. 274,CULIACAN,,80000,MX
PERDOMO SIERRA MICHELLE MARIANA,AQUILES SERDAN 63 SUR,"COL CENTRO, CULIACAN",,80000,MX
"ASOCIACION OPTIKA GHC, SA DE CV",AV DONATO GUERRA 580 SUR,CULIACAN,,80200,MX
A723 CULIACAN PLAZA FIESTA,AV INSURGENTES Y L. CARDENAS SN,CULIACAN ROSALES,,80200,MX
VARGAS BONILLA JUAN,JESUS G ANDRADE No. 501 INT 2,CULIACAN,,80200,MX
ZAZUETA MEDINA HERIBERTO,AV. ALVARO OBREGON No. 1106,CULIACAN,,80220,MX
B933 CIMACO CULIACAN,BLVD PEDRO INFANTE 3000,CULIACAN,,80100,MX
ESQUIVEL GARCIA LUIS FELIPE,JUAN DE DIOS BATIZ 139,CULIACAN,,80220,MX
MONARREZ FELIX IRMA,AV. ALVARO OBREGON No. 1880,CULIACAN,,80228,MX
EM: MARTINEZ MARTINEZ JESUS,MIGUEL HIDALGO OTE 32,CULIACAN,,80170,MX
B287 SEARS CULIACAN,BLVD ALVARO OBREGON SUR 1980,CULIACAN,,80228,MX
B484 WALMART MEXICO 68 CULIACAN,AV GENERAL ALVARO OBREGON 2891,CULIACAN,,80227,MX
B871 EXPLANADA CULIACAN,BLVD JESUS KUMATE R 5388,CULIACAN,,80104,MX
B794 DEVLYN PLAZA BARRANCOS,AV ALMA SHILLER DE Z 4320,CULIACAN,,80189,MX
NEVAREZ GUTIERREZ BRISEIDA,INDEPENDENCIA 243,CULIACAN,,80430,MX
B030 GUAMUCHIL PLAZA EVORA,BLVD ANTONIO ROSALES SN LOC 12,SALVADOR ALVARDO GUAMUCHIL,,81460,MX
RICHARD INZUNZA MARIA DE JESUS,BLVD GRAL ANTONIO ROSALES 255,GUAMUCHIL,,81400,MX
B243 SORIANA LAS ROSAS,BLVD MIGUEL ALEMAN 1060,GOMEZ PALACIO,,35000,MX
PEREZ MORALES ELIZABETH,CALZ. MANUEL GOMEZ MORIN 609,TORREON,,27276,MX
EM: SUC. 69 TORREON ALMANARA (TAL),RAUL LOPEZ SANCHEZ 500 LOC 36,TORREON,,27018,MX
DE LA HOYA OLVERA ALEJANDRA,AV JUAREZ 1822 2DO PISO,TORREON,,27000,MX
DEL TORO AMEZCUA ARLETTE MICHELLE,AV JUAREZ 1822,TORREON,,27000,MX
OLVERA DEL MORAL MARIA YOLANDA,JUAREZ 1822 OTE,TORREON,,27000,MX
"CIA COMERCIAL CIMACO, SA DE CV",AV HIDALGO No. 399 PTE,COL TORREON CENTRO,,27000,MX
DELGADO MORALES CYNTHIA ELIZABETH,AV. MORELOS 610 PTE,TORREON,,27000,MX
NERI MARTINEZ NORMA LETICIA,JUAREZ 246 PONIENTE,TORREON,,27000,MX
"OPTICAS FRANKLIN, S.DE R.L DE C.V.",AV JUAREZ 1534,TORREON,,27000,MX
A958 TORREON CENTRO,AV MORELOS PTE 1184,TORREON,,27000,MX
A618 COPPEL BOULEVARD (MATAMOROS),AV CUAUHTEMOC,MATAMOROS,,27446,MX
B434 TORREON SORIANA,CLZDA DIVISION DEL NORTE  950,TORREON,,27276,MX
LUJAN ACOSTA MARIA ELENA,IDELFONSO FUENTES No. 527 SUR,TORREON,,27000,MX
EM: SUC. 06 TORREON (TOR) - OPTICAS,AV JUAREZ No. 1534,TORREON,,27000,MX
1019 GOMEZ PALACIO,BLVD MIGUEL ALEMAN NO 117 OTE,FLORES MAGON,,35000,MX
A739 TORREON PLAZA 4 CAMINOS,BLVD INDEPENDENCIA 1300 LOC 103,TORREON,,27010,MX
B297 TORREON SEARS GALERIAS,PERIF RUAL LOPEZ SANCHEZ 6000,TORREON,,27100,MX
JUAREZ PACHECO ELISEO,BLVD. MIGUEL ALEMAN No. 425 PTE,GOMEZ PALACIO,,35080,MX
B284 GOMEZ PALACIO SEARS,BLVD MIGUEL ALEMAN S/N,GOMEZ PALACIO,,35080,MX
A990 GOMEZ PALACIO CENTRO,AV MORELOS NTE 372,GOMEZ PALACIO,,35000,MX
B243 SORIANA LAS ROSAS,BLVD MIGUEL ALEMAN 1060,GOMEZ PALACIO,,35000,MX
1001 TORREON,CALZADA SALTILLO 400,TORREON,,27267,MX
A740 TORREON GALERIAS LA LAGUNA,PERIF RAUL LOPEZ SANCHEZ 6000 L12,TORREON,,27018,MX
A619 COPPEL SAN PEDRO DE LAS COLINA,BLVD TORREON 506,SAN PEDRO,,27800,MX
A619 COPPEL SAN PEDRO DE LAS COLINA,BLVD TORREON 506,SAN PEDRO,,27800,MX
A957 SALTILLO CENTRO,ALLENDE 302,SANTILLO,,25000,MX
SANCHEZ VALDES EDGAR ADRIAN,MOCTEZUMA No. 1860,SALTILLO,,25198,MX
1004 SALTILLO,PERIFERICO LUIS ECHEVERRÍA 6385,SALTILLO,,25020,MX
EM: SUC. 16 SALTILLO (SAL) - OPTICA,ALDAMA NUM. 558 PONIENTE,SALTILLO,,25000,MX
A897 SENDERO SALTILLO,CARR LOS GONZALEZ 365,SALTILLO,,25023,MX
OPTICOS Y ACCESORIOS VISUALES,AV UNIVERSIDAD No. 578,SALTILLO,,25260,MX
SERVICIOS DE SALUD VISUAL,BLVD FUNDADORES 7540 INT 3,SALTILLO,,25294,MX
EM: SUC. 21 SENDERO SALTILLO (SSA),CARR A LOS GONZALEZ 365 LOC 1G,SALTILLO,,25203,MX
A470 CIMACO SALTILLO,CARR. LOS GONZALEZ 365,SALTILLO,,25203,MX
0065 L SALTILLO,BLVD NAZARIO S ORTIZ GARZA 2345,"COL TANQUE DE PENA, SALTILLO",,25279,MX
A779 GALERIAS SALTILLO,BLVD NAZARIO ORTIZ GARZA L-231,SALTILLO,,25260,MX
EM: VARGAS AVDEEVA ANAIS YAROSLAVA,BLVD CTRO DE CONVENCIONES 443,SALTILLO,,25016,MX
B787 PLAZOLETA GARCIA,BLVD HERIBERTO CASTILLO MARTINEZ,GARCIA,,66000,MX
MARTINEZ DOMINGUEZ FILY,CAMINO AL VAPOR 141,MONTEMORELOS,,67515,MX
HOSPITAL LA CARLOTA SC,CAMINO AL VAPOR 59,MONTEMORELOS,,67500,MX
A024 ESFERA MONTERREY,"CARR NACIONAL KM 268, LOC A 103",MONTERREY,,64984,MX
0457 L MONTERREY ESFERA,CARRETERA NACIONAL No. 245,COL VILLAS LA RIOJA,,64984,MX
A982 PLAZA CADEREYTA,BLVD REVOLUCION 1103 LOC D07,CADEREYTA JIMENEZ,,67480,MX
"BONHAM COMERCIALIZACION, SA DE CV",AV SENDERO SUR No. 214 LOC 3,MONTERREY,,64860,MX
EM: SUC. 22 PLAZA LA SILLA (SIL) -,AV EUGENIO GARZA SADA 3755 SUR,MONTERREY,,64860,MX
A748 PLAZA VALLE ORIENTE,AV LAZARO CARDENAS 1000 LOC 1136,MONTERREY,,64750,MX
1230 MTY NUEVO SUR,AV REVOLUCION 2703 SA-04,MONTERREY,,64830,MX
EM: SUC. 08 ARCADIA (ARC) - OPTICAS,AV. ELOY CAVAZOS 3301 INT. L-23,GUADALUPE,,67170,MX
EM: D'CLASS OPTICA S.A. DE CV,BATALLON DE SAN PATRICIO No. 112,SAN PEDRO GARZA GARCIA,,66278,MX
1030 REVOLUCION,AV REVOLUCION 1009,MONTERREY,,64820,MX
B446 VETRO PLAZA FIESTA SAN AGUSTIN,AV REAL SAN AGUSTIN 222 LOC 1012,SAN PEDRO GARZA GARCIA,,66260,MX
B280 MTY. SN AGUSTIN SEARS,AV BATALLON DE SAN PATRICIO 1000,SAN PEDRO GARZA GARCIA,,66278,MX
A722 MTY PLAZA FIESTA SAN AGUSTIN,"AV REAL SAN AGUSTIN LOC 1, 2 Y 3",SAN PEDRO GARZA GARCIA,,66260,MX
CALDERON CASTRO JORGE RAMIRO,B DE SAN PATRICIO 1000 L2105,SAN PEDRO GARZA GARCIA,,66260,MX
0045 L MONTERREY VALLE,LAZARO CARDENAS 1000 OTE,COL VALLE ORIENTE,,66260,MX
1045 MONTERREY SAN AGUSTIN,AV. LAZARO CARDENAS No. 314,COL. DEL VALLE,,66259,MX
KHROMA OPTICA SA DE CV,AV GOMEZ MORIN No 300,SAN PEDRO GARZA GARCIA,,66225,MX
BAUTISTA GAYTAN ALEJANDRA,AV CHAPULTEPEC 1836,MONTERREY,,64800,MX
B195 OAH PHO NL MONTERREY VASCONCEL,JOSE VASCONCELOS 402,SAN PEDRO GARZA GARCIA,,66220,MX
A761 PASEO SAN PEDRO,JOSE VASCONCELOS 402 LOC 268,SN PEDRO GARZA GARCIA,,66220,MX
OFTALMOINTEGRA DE MONTERREY,DAVID ALFARO SIQUEIROS 104 PISO 9,COL VALLE OTE,,66269,MX
FLORES GONZALEZ LUIS ANTONIO,MORELOS No. 101 INT. 110,MONTERREY,,64000,MX
EM: SUC. 39 PADRE MIER (MTY) - OPTI,PADRE MIER NUM 455 OESTE,MONTERREY,,64000,MX
EM: ILLAN RAMIREZ GENOVEVA,RIO AMAZONAS No. 409 LOC. 8,SAN PEDRO GARZA GARCÍA,,66220,MX
A979 MTY PADRE MIER,PADRE MIER PTE 159,MONTERREY,,64000,MX
B264 MTY. SEARS CENTRO,AV PADRE MIER 143,MONTERREY,,64000,MX
EM: SUC. MONTERREY - OPERADORA,AV. BENITO JUAREZ SUR 123,MONTERREY,,64000,MX
GONZALEZ GARZA BERTHA,JUAN I RAMON OTE 314,MONTERREY,,64000,MX
SALAZAR MARTINEZ NOE,EMILIO CARRANZA No. 122 SUR,MONTERREY,,64000,MX
SERVICIOS Y ASESORIAS LOMA LARGA,AV LA CLINICA 2520 DESP 221,MONTERREY,,64718,MX
A029 PASEO LA FE,AV MIGUEL ALEMAN 200 A-12,SAN NICOLAS DE LOS GARZA,,66470,MX
B436 SORIANA SAN PEDRO,HUMBERTO LOBO 520,SAN PEDRO DE LOS GARZA GARCIA,,66200,MX
A904 MULTIPLAZA LINDAVISTA,AV MIGUEL ALEMAN 5064 LOC 122,GUADALUPE,,67130,MX
B879 PUNTO VALLE MTY,RIO MISSOURI 555 L304,SAN PEDRO GARZA GARCIA,,66220,MX
"OPTICAS PREMIER, S.A. DE C.V.",COLEGIO CIVIL 860 NTE.,MONTERREY,,64000,MX
EM: SUC. 11 CUAUHTEMOC (CUA) -,CUAUHTEMOC NUM. 902 NORTE,MONTERREY,,64000,MX
A994 MTY FAMSA CENTRO,AV CRISTOBAL COLON 601,MONTERREY,,64000,MX
A774 GALERIAS MONTERREY,FELIPE BENAVIDES 2500 LOC 181,MONTERREY,,64620,MX
A598 COPPEL HIDALGO (LINARES),AV DR CARLOS GARCIA RODRIGUEZ 505,LINARES,,67700,MX
A620 COPPEL LINARES,AV HIDALGO 960,LINARES,,67700,MX
HOSPITAL LA CARLOTA SC,CAMINO AL VAPOR 59,MONTEMORELOS,,67500,MX
MARTINEZ DOMINGUEZ FILY,CAMINO AL VAPOR 141,MONTEMORELOS,,67515,MX
A982 PLAZA CADEREYTA,BLVD REVOLUCION 1103 LOC D07,CADEREYTA JIMENEZ,,67480,MX
EM: TAMAYO RODRIGUEZ CLAUDIA,BENITO JUAREZ 538 OTE,VICTORIA,,87000,MX
OPTICAS DE MEXICO CENTRO DE,BENITO JUAREZ No. 538,VICTORIA,,87000,MX
OPTICAS DE MEXICO CENTRO DE,BENITO JUAREZ No. 538,VICTORIA,,87000,MX
EM: TAMAYO RODRIGUEZ CLAUDIA,BENITO JUAREZ 538 OTE,VICTORIA,,87000,MX
A634 COPPEL JUAREZ (MATAMOROS),AV DEL NINO 41,MATAMOROS,,87455,MX
A830 MATAMOROS PLAZA,AV PEDRO CARDENAS LOC 1 Y 2,MATAMOROS,,87390,MX
B175 SENDERO MATAMOROS,AV CONSTITUYENTES 300 LOC 22,MATAMOROS,,87315,MX
A645 COPPEL PATIO MATAMOROS,AV CONSTITUYENTES 300,MATAMOROS,,87348,MX
OPTICAS INTERAMERICANA SA DE CV,AV. PEDRO CARDENAS 1901 LOC. 30,MATAMOROS,,87390,MX
A553 COPPEL MATAMOROS,AV PEDRO CARDENAS 1901,MATAMOROS,,87390,MX
OPPENHEIMER EYE CLINIC PLLC,3306 N ROOSEVELT BLVD,KEY WEST,FL,33040,US
KEY WEST OPTICAL,1444 KENNEDY DR,KEY WEST,FL,33040-4008,US
JAMES J BOILINI OD,99696 OVERSEAS HWY,KEY LARGO,FL,33037-2432,US
PATRICK DEL VECCHIO PA,28 N HOMESTEAD BLVD,HOMESTEAD,FL,33030,US
DADE OPTICAL LABORATORY,948 N KROME AVE,HOMESTEAD,FL,33030-4409,US
SENIA BUSTILLO OD PA,8765 S W 165TH AVE STE 107,MIAMI,FL,33193,US
EYEWEAR DISTRIBUTION,9437 SW 143RD PL,MIAMI,FL,33186,US
HAGEN EYE CARE,12977 SW 112TH ST,MIAMI,FL,33186,US
SAVITRI BADRI MAHARAJ,12225 S W 128TH ST UNIT 104,MIAMI,FL,33186,US
DR MARIO CARCAMO,13852 SW 88TH ST,MIAMI,FL,33186,US
CJ HOLDING,13676 N KENDALL DR,MIAMI,FL,33186,US
JAMES J BOILINI OD,99696 OVERSEAS HWY,KEY LARGO,FL,33037-2432,US
PATRICK DEL VECCHIO PA,28 N HOMESTEAD BLVD,HOMESTEAD,FL,33030,US
DADE OPTICAL LABORATORY,948 N KROME AVE,HOMESTEAD,FL,33030-4409,US
LIANNE M PINO OD PA,9000 SW 152ND ST STE 205,PALMETTO BAY,FL,33157-1942,US
CLARIN EYECARE,14429 S DIXIE HWY,MIAMI,FL,33176-7924,US
"GARY P. GEGERSON, OD",12139 SOUTH DIXIE HWY,MIAMI,FL,33156,US
SPECS APPEAL,11217 S DIXIE HWY,MIAMI,FL,33156-4443,US
SAVITRI BADRI MAHARAJ,12225 S W 128TH ST UNIT 104,MIAMI,FL,33186,US
PAMELA MINKES OD PA,11734 S W 104TH ST,MIAMI,FL,33186,US
HAGEN EYE CARE,12977 SW 112TH ST,MIAMI,FL,33186,US
OPTICAL WORLD,7535 N KENDALL DR STE 3140,MIAMI,FL,33156,US
FAMILY EYECARE CENTER,9065 SW 87TH AVE STE 107,MIAMI,FL,33176-2307,US
DR PHILIP MARGOLESKY,7535 N KENDALL DR STE 2240,MIAMI,FL,33156-7702,US
SCHNEIDER EYE CENTER,7450 SW 57TH AVE,SOUTH MIAMI,FL,33143,US
EYE CARE OPTICAL CENTER,7300 SW 57TH AVE,SOUTH MIAMI,FL,33143-5312,US
C & K EYECARE,11654 N KENDALL DR,MIAMI,FL,33176-1005,US
JAMES SEGAL MD PA,5858 SW 68TH ST,MIAMI,FL,33143,US
SANCHEZ OPTICAL,12859 SW 88TH ST,MIAMI,FL,33186,US
EYEWEAR DISTRIBUTION,9437 SW 143RD PL,MIAMI,FL,33186,US
CJ HOLDING,13676 N KENDALL DR,MIAMI,FL,33186,US
DR MARIO CARCAMO,13852 SW 88TH ST,MIAMI,FL,33186,US
SENIA BUSTILLO OD PA,8765 S W 165TH AVE STE 107,MIAMI,FL,33193,US
ADOLFO TAPIA,8260 SW 43RD TER,MIAMI,FL,33155-4217,US
ABC OPTOMETRY INC,8748 BIRD RD,MIAMI,FL,33165,US
OPTIWOW,3200 SW 60TH CT STE 103,MIAMI,FL,33155-4069,US
DR EDWARD WEISS,9844 SW 40TH ST,MIAMI,FL,33165-3912,US
INTERNATIONAL OPT(2635),2264 CORAL WAY,CORAL GABLES,FL,33145-3509,US
OPTICAL LOPEZ,3025 CORAL WAY,Miami,FL,33145-3207,US
CLARIN EYECARE,58 MIRACLE MILE,CORAL GABLES,FL,33134,US
L GONZALEZ OD PA,11760 SW 40TH ST STE 101,MIAMI,FL,33175-3530,US
RICHARD PADRON OD PA,2200 SW 16TH ST STE 204,MIAMI,FL,33145,US
SUAREZ OPTICAL INC,8100 SW 24TH ST,MIAMI,FL,33155-1227,US
WEST KENDALL EYE CARE,14411 SW 42ND ST,MIAMI,FL,33175-7818,US
ROTH EYE CARE,136 NE 2ND AVE,MIAMI,FL,33132-2509,US
DR LIANETTE LARIA PA,8220 W FLAGLER ST,MIAMI,FL,33144-2028,US
"C JUSTIN HOLCOMB, OD LLC",8410 W FLAGLER ST STE 201,MIAMI,FL,33144,US
STAR OPTICAL LLC,930 WASHINGTON AVE 5TH FL,MIAMI BEACH,FL,33139,US
CARTERS OPTICAL,6703 NW 7TH ST  POS 3179,MIAMI,FL,33126,US
JCA OPTICAL LTD,6703 NW 7TH ST  POS #63488,MIAMI,FL,33126,US
OPTICAL DEPARTMENT MIAMI,900 NW 17TH ST 1ST FL,MIAMI,FL,33136,US
JOHN BULL LTD,284 BAY ST,NASSAU,,,BS
BAHAMAS VISION CENTRE,PO BOX N 386,NASSAU,,9,BS
FAMILY EYE CARE CENTER,65 COLLINS AVE,NASSAU,,,BS
IMPERIAL OPTICAL CO LTD,ROSETTA ST 32 SIXTH TERRACE,NASSAU,,0,BS
IMPERIAL OPTICAL CO LTD,ROSETTA ST 32 SIXTH TERRACE,NASSAU,,0,BS
JOHN BULL LTD,284 BAY ST,NASSAU,,,BS
FAMILY EYE CARE CENTER,65 COLLINS AVE,NASSAU,,,BS
BAHAMAS VISION CENTRE,PO BOX N 386,NASSAU,,9,BS
AMARILLAS AGUILAR JORGE,AV. SALVATIERRA S/N,LORETO,,23880,MX
SAHARA ARMENDARIZ EDUARDO JAVIER,WENCESLAO LINK S/N L-9,LORETO,,23880,MX
SAHARA ARMENDARIZ EDUARDO JAVIER,WENCESLAO LINK S/N L-9,LORETO,,23880,MX
AMARILLAS AGUILAR JORGE,AV. SALVATIERRA S/N,LORETO,,23880,MX
ROCHA BELTRAN GILBERTO,BENITO JUAREZ No. 338 PTE,AHOME,,81200,MX
B728 SENDERO LOS MOCHIS,BLVD ANTONIO ROSALES 2300 LOC D3,AHOME,,81210,MX
VARELA SARABIA MONICA,RODOLFO T.LOAIZA No. 610-210,AHOME,,81220,MX
MANJARREZ VARELA LINA MARGARITA,SERAPIO RENDON No. 561 PTE.,AHOME,,81200,MX
EM: SUC. PLAZA CIUDAD OBREGON,NO REELECCION No. 826,AHOME,,81200,MX
LEDESMA MELECIO ZARHAEMLA,ALVARO OBREGON PTE No. 1431-A,AHOME,,81245,MX
OPTICA GARCIA S.A.DE C.V,GABRIEL LEYVA No. 198 SUR,AHOME,,81200,MX
B004 LOS MOCHIS CENTRO,AV INDEPENDENCIA 385,AHOME,,81200,MX
ACOSTA NAVARRO ROMINA PAOLA,GABRIEL LEYVA SUR No. 160,AHOME,,81200,MX
B311 SEARS LOS MOCHIS,BLVD CENTENARIO 805 LOC A-2,AHOME,,81271,MX
0305 L LOS MOCHIS,BLVD. CENTENARIO No. 805 PTE,ESQ ANTONIO ROSALES,,81270,MX
A960 LOS MOCHIS PLAZA FIESTA,BLVD ANTONIO ROSALES LOC 1,AHOME LOS MOCHIS,,81200,MX
A905 PASEO LOS MOCHIS,BLVD CENTENARIO 805 LOC A-2,AHOME,,81200,MX
EM: SUC PLAZA LOS MOCHIS -OPERADORA,GUILLERMO PRIETO No. 459 LOCAL B,AHOME,,81200,MX
B882 WALMART GUASAVE,AV PASEO MIGUEL LEYSON PEREZ,GUASAVE,,81020,MX
B493 CASA LEY GUASAVE,AV ARTURO PEIBERT CAMACH SN,GUASAVE,,81040,MX
EM: AHUMADA CHAVEZ CARMEN ZAMIRA,JUAN CARRASCO 461,GUASAVE,,81000,MX
LOPEZ ZENDEJAS LUZ DEL CARMEN,CARRASCO SN,GUASAVE,,81000,MX
EM: LUGO GARCIA CARMEN MARIA,CUAUHTEMOC No. 38,GUASAVE,,81000,MX
1145 CULIACAN,BLVD. CARLOS SALINAS DE GORTARI,No. 1676 PTE. FRACCIONAMIENTO,,80000,MX
1145 CULIACAN,BLVD. CARLOS SALINAS DE GORTARI,No. 1676 PTE. FRACCIONAMIENTO,,80000,MX
B882 WALMART GUASAVE,AV PASEO MIGUEL LEYSON PEREZ,GUASAVE,,81020,MX
EM: AHUMADA CHAVEZ CARMEN ZAMIRA,JUAN CARRASCO 461,GUASAVE,,81000,MX
LOPEZ ZENDEJAS LUZ DEL CARMEN,CARRASCO SN,GUASAVE,,81000,MX
EM: LUGO GARCIA CARMEN MARIA,CUAUHTEMOC No. 38,GUASAVE,,81000,MX
B493 CASA LEY GUASAVE,AV ARTURO PEIBERT CAMACH SN,GUASAVE,,81040,MX
RICHARD INZUNZA MARIA DE JESUS,BLVD GRAL ANTONIO ROSALES 255,GUAMUCHIL,,81400,MX
B030 GUAMUCHIL PLAZA EVORA,BLVD ANTONIO ROSALES SN LOC 12,SALVADOR ALVARDO GUAMUCHIL,,81460,MX
B728 SENDERO LOS MOCHIS,BLVD ANTONIO ROSALES 2300 LOC D3,AHOME,,81210,MX
A740 TORREON GALERIAS LA LAGUNA,PERIF RAUL LOPEZ SANCHEZ 6000 L12,TORREON,,27018,MX
A619 COPPEL SAN PEDRO DE LAS COLINA,BLVD TORREON 506,SAN PEDRO,,27800,MX
1001 TORREON,CALZADA SALTILLO 400,TORREON,,27267,MX
B297 TORREON SEARS GALERIAS,PERIF RUAL LOPEZ SANCHEZ 6000,TORREON,,27100,MX
A739 TORREON PLAZA 4 CAMINOS,BLVD INDEPENDENCIA 1300 LOC 103,TORREON,,27010,MX
EM: SUC. 06 TORREON (TOR) - OPTICAS,AV JUAREZ No. 1534,TORREON,,27000,MX
A990 GOMEZ PALACIO CENTRO,AV MORELOS NTE 372,GOMEZ PALACIO,,35000,MX
