B319 SEARS LA PAZ CENTRO,AV 16 DE SEPTIEMBRE 111 ZN,LA PAZ,,23000,MX
TAMAYO VELAZQUEZ JAVIER ANTONIO,ALTAMIRANO No. 407,LA PAZ,,23000,MX
EM: SUC. LA PAZ - ISIDRO VALDEZ MAD,I. ALTAMIRANO S/N,LA PAZ,,23000,MX
EM: POLANCO SALGADO ABRAHAM,CALLE PINEDA NO. 776,LA PAZ,,23000,MX
A919 PUNTO LA PAZ,BLVD CONSTITUYENTES DE SCM 54,LA PAZ,,23090,MX
B316 SEARS LA PAZ FORJADORES,BLVD FORJADORES DE SUBCALIFORNIA,LA PAZ,,23050,MX
B798 PASEO LAPAZ,BLVD AGUSTIN OLACHEA AVILES 1515,LA PAZ,,23090,MX
A872 SORIANA FORJADORES APERTURA,BLVD FORJADORES SN  LOC 3,LA PAZ,,23050,MX
SERRANO CASTRO IRENE,AV. FORJADORES DE SUDCALIFORNIA,LA PAZ,,23050,MX
TAMAYO VELAZQUEZ JAVIER ANTONIO,ALTAMIRANO No. 407,LA PAZ,,23000,MX
EM: POLANCO SALGADO ABRAHAM,CALLE PINEDA NO. 776,LA PAZ,,23000,MX
B319 SEARS LA PAZ CENTRO,AV 16 DE SEPTIEMBRE 111 ZN,LA PAZ,,23000,MX
EM: SUC. LA PAZ - ISIDRO VALDEZ MAD,I. ALTAMIRANO S/N,LA PAZ,,23000,MX
SERRANO CASTRO IRENE,AV. FORJADORES DE SUDCALIFORNIA,LA PAZ,,23050,MX
A872 SORIANA FORJADORES APERTURA,BLVD FORJADORES SN  LOC 3,LA PAZ,,23050,MX
B798 PASEO LAPAZ,BLVD AGUSTIN OLACHEA AVILES 1515,LA PAZ,,23090,MX
B316 SEARS LA PAZ FORJADORES,BLVD FORJADORES DE SUBCALIFORNIA,LA PAZ,,23050,MX
A919 PUNTO LA PAZ,BLVD CONSTITUYENTES DE SCM 54,LA PAZ,,23090,MX
FELIX RUBIO DINA,MIGUEL HIDALGO OTE 74,CULIACAN,,80000,MX
B794 DEVLYN PLAZA BARRANCOS,AV ALMA SHILLER DE Z 4320,CULIACAN,,80189,MX
B871 EXPLANADA CULIACAN,BLVD JESUS KUMATE R 5388,CULIACAN,,80104,MX
B484 WALMART MEXICO 68 CULIACAN,AV GENERAL ALVARO OBREGON 2891,CULIACAN,,80227,MX
B287 SEARS CULIACAN,BLVD ALVARO OBREGON SUR 1980,CULIACAN,,80228,MX
B933 CIMACO CULIACAN,BLVD PEDRO INFANTE 3000,CULIACAN,,80100,MX
A723 CULIACAN PLAZA FIESTA,AV INSURGENTES Y L. CARDENAS SN,CULIACAN ROSALES,,80200,MX
PERDOMO SIERRA MICHELLE MARIANA,AQUILES SERDAN 63 SUR,"COL CENTRO, CULIACAN",,80000,MX
CASTRO ROMO FLERIDA DRUCILA,CRISTOBAL COLON PTE No. 274,CULIACAN,,80000,MX
BARRON MONTES JESUS OLIVIA,MARIANO ESCOBEDO OTE  No. 234,CULIACAN,,80000,MX
EM: OPERADORA PARA LAS MEJORES OPT,ESCOBEDO No. 258,CULIACAN,,80000,MX
ALMANZA CASTILLO ARTURO RAFAEL,HIDALGO ORIENTE No. 181,CULIACAN,,80000,MX
A978 CULIACAN CENTRO,AV. ANTONIO ROSALES 216,CULIACAN ROSALES,,80000,MX
CAMARENA LEDESMA MARCELA DE LOS,BLVD SINALOA No. 716 A,CULIACAN,,80060,MX
A750 FORUM CULIACAN,BLVD JOSE DIEGO VALADES 1676 PB07,CULIACAN ROSALES,,80027,MX
0046 L CULIACAN,BLVD. JOSE DIEGO VALADEZ 1676,PONIENTE COL. DESARROLLO URBANO,,80000,MX
"GRUPO MISOCRI, SA DE CV",BLVD. JOSE DIEGO VALADEZ No. 1676,CULIACAN,,80020,MX
B298 SEARS FORUM CULIACAN,BLVD DIEGO VALADEZ RIOS 1676,CULIACAN,,80027,MX
A833 CULIACAN LA CAMPINA,BLVD DR MORA 1725 LOC 6-G,CULIACAN ROSALES,,80060,MX
EM: SUC. 81 SUNCITY FORUM CULIACAN,BLVD. JOSE DIEGO V. No. 1676,CULIACAN,,80020,MX
B727 SENDERO CULIACAN,JOSE LIMON CALZADA 2545 LOC 10,CULIACAN,,80020,MX
FELIX RUBIO DINA,MIGUEL HIDALGO OTE 74,CULIACAN,,80000,MX
SOTO GALLEGOS MARIA EUFROCINA,BRUNO MARTINEZ No. 144 SUR,DURANGO,,34000,MX
GALLARDO OLGUIN MARIA DEL RAYO,HIDALGO No. 303 SUR,DURANGO,,34000,MX
B295 SEARS CENTRO DURANGO,CONSTITUCION 163,DURANGO,,34000,MX
RODRIGUEZ PIEDRA HERIBERTO,CONSTITUCION SUR 206,DURANGO,,34000,MX
EM: BORREGO NUNEZ GRACIELA,AV 20 NOVIEMBRE PTE No 203A,DURANGO,,34000,MX
ANZA OPTICOS S.A. DE C.V.,PATONI 121 NTE,DURANGO,,34000,MX
A770 PASEO DURANGO,BLVD FELIPE PESCADOR 1401,COL PRIVADA DEL SAHUARO,,34000,MX
LUJAN SERRANO ROBERTO,JUAREZ 201-B SUR,DURANGO,,34000,MX
B293 SEARS PASEO DURANGO,AV FELIPE PESCADOR 1401,DURANGO,,34080,MX
BORREGO NUNEZ GRACIELA,BLVD. FELIPE PESCADOR No. 1401,DURANGO,,34080,MX
ANDRADE AVALOS JUAN CARLOS,AV. 5 DE FEBRERO No. 114 OTE,DURANGO,,34000,MX
ANDRADE ZAMORA JESUS LUIS,DIEGO DE IBARRA LOC. 25 C,DURANGO,,34080,MX
ANDRADE ZAMORA LORENZO IVAN,CAPITAN FRANCISCO DE IBARRA,DURANGO,,34080,MX
EM: SUC. 15 DURANGO (DGO) -,AV JUAREZ No. 311,DURANGO,,34000,MX
EM: SUC. 15 DURANGO (DGO) -,AV JUAREZ No. 311,DURANGO,,34000,MX
A770 PASEO DURANGO,BLVD FELIPE PESCADOR 1401,COL PRIVADA DEL SAHUARO,,34000,MX
B293 SEARS PASEO DURANGO,AV FELIPE PESCADOR 1401,DURANGO,,34080,MX
BORREGO NUNEZ GRACIELA,BLVD. FELIPE PESCADOR No. 1401,DURANGO,,34080,MX
ANDRADE ZAMORA LORENZO IVAN,CAPITAN FRANCISCO DE IBARRA,DURANGO,,34080,MX
ANDRADE ZAMORA JESUS LUIS,DIEGO DE IBARRA LOC. 25 C,DURANGO,,34080,MX
LUJAN SERRANO ROBERTO,JUAREZ 201-B SUR,DURANGO,,34000,MX
ANDRADE AVALOS JUAN CARLOS,AV. 5 DE FEBRERO No. 114 OTE,DURANGO,,34000,MX
ANZA OPTICOS S.A. DE C.V.,PATONI 121 NTE,DURANGO,,34000,MX
EM: BORREGO NUNEZ GRACIELA,AV 20 NOVIEMBRE PTE No 203A,DURANGO,,34000,MX
B295 SEARS CENTRO DURANGO,CONSTITUCION 163,DURANGO,,34000,MX
RODRIGUEZ PIEDRA HERIBERTO,CONSTITUCION SUR 206,DURANGO,,34000,MX
SOTO GALLEGOS MARIA EUFROCINA,BRUNO MARTINEZ No. 144 SUR,DURANGO,,34000,MX
GALLARDO OLGUIN MARIA DEL RAYO,HIDALGO No. 303 SUR,DURANGO,,34000,MX
A620 COPPEL LINARES,AV HIDALGO 960,LINARES,,67700,MX
A598 COPPEL HIDALGO (LINARES),AV DR CARLOS GARCIA RODRIGUEZ 505,LINARES,,67700,MX
B838 PLAZA CAMPESTRE CD VICTORIA,BLVD TAMAULIPAS 3262 LOC 7,TAMAULIPAS,,87027,MX
TAMAYO RODRIGUEZ CLAUDIA ANGELICA,AV. DEL VALLE 1126 LOC 3,VICTORIA,,87029,MX
A596 COPPEL LAS ADELITAS,JESUS ELIAS PINA 24,VICTORIA,,87049,MX
B887 SORIANA CD VICTORIA,JUAN B TIJERINA 2033 LOC 12E,CD VICTORIA,,87140,MX
JARAMILLO TURRUBIATES JUAN JOSE,AV ALBERTO CARRERA TORRES 510-A,VICTORIA,,87000,MX
A683 COPPEL MORELOS CD VICTORIA,JOSE MARIA MORELOS 1001,VICTORIA,,87000,MX
EM: TAMAYO RODRIGUEZ CLAUDIA,BENITO JUAREZ 538 OTE,VICTORIA,,87000,MX
OPTICAS DE MEXICO CENTRO DE,BENITO JUAREZ No. 538,VICTORIA,,87000,MX
EM: TAMAYO RODRIGUEZ CLAUDIA,BENITO JUAREZ 538 OTE,VICTORIA,,87000,MX
OPTICAS DE MEXICO CENTRO DE,BENITO JUAREZ No. 538,VICTORIA,,87000,MX
BAHAMAS VISION CENTRE,PO BOX N 386,NASSAU,,9,BS
EM: SUC PLAZA LOS MOCHIS -OPERADORA,GUILLERMO PRIETO No. 459 LOCAL B,AHOME,,81200,MX
A905 PASEO LOS MOCHIS,BLVD CENTENARIO 805 LOC A-2,AHOME,,81200,MX
A960 LOS MOCHIS PLAZA FIESTA,BLVD ANTONIO ROSALES LOC 1,AHOME LOS MOCHIS,,81200,MX
B311 SEARS LOS MOCHIS,BLVD CENTENARIO 805 LOC A-2,AHOME,,81271,MX
0305 L LOS MOCHIS,BLVD. CENTENARIO No. 805 PTE,ESQ ANTONIO ROSALES,,81270,MX
ACOSTA NAVARRO ROMINA PAOLA,GABRIEL LEYVA SUR No. 160,AHOME,,81200,MX
B004 LOS MOCHIS CENTRO,AV INDEPENDENCIA 385,AHOME,,81200,MX
OPTICA GARCIA S.A.DE C.V,GABRIEL LEYVA No. 198 SUR,AHOME,,81200,MX
LEDESMA MELECIO ZARHAEMLA,ALVARO OBREGON PTE No. 1431-A,AHOME,,81245,MX
EM: SUC. PLAZA CIUDAD OBREGON,NO REELECCION No. 826,AHOME,,81200,MX
B493 CASA LEY GUASAVE,AV ARTURO PEIBERT CAMACH SN,GUASAVE,,81040,MX
MANJARREZ VARELA LINA MARGARITA,SERAPIO RENDON No. 561 PTE.,AHOME,,81200,MX
VARELA SARABIA MONICA,RODOLFO T.LOAIZA No. 610-210,AHOME,,81220,MX
EM: AHUMADA CHAVEZ CARMEN ZAMIRA,JUAN CARRASCO 461,GUASAVE,,81000,MX
B882 WALMART GUASAVE,AV PASEO MIGUEL LEYSON PEREZ,GUASAVE,,81020,MX
B728 SENDERO LOS MOCHIS,BLVD ANTONIO ROSALES 2300 LOC D3,AHOME,,81210,MX
ROCHA BELTRAN GILBERTO,BENITO JUAREZ No. 338 PTE,AHOME,,81200,MX
B030 GUAMUCHIL PLAZA EVORA,BLVD ANTONIO ROSALES SN LOC 12,SALVADOR ALVARDO GUAMUCHIL,,81460,MX
EM: AHUMADA CHAVEZ CARMEN ZAMIRA,JUAN CARRASCO 461,GUASAVE,,81000,MX
B493 CASA LEY GUASAVE,AV ARTURO PEIBERT CAMACH SN,GUASAVE,,81040,MX
B882 WALMART GUASAVE,AV PASEO MIGUEL LEYSON PEREZ,GUASAVE,,81020,MX
1145 CULIACAN,BLVD. CARLOS SALINAS DE GORTARI,No. 1676 PTE. FRACCIONAMIENTO,,80000,MX
B727 SENDERO CULIACAN,JOSE LIMON CALZADA 2545 LOC 10,CULIACAN,,80020,MX
EM: SUC. 81 SUNCITY FORUM CULIACAN,BLVD. JOSE DIEGO V. No. 1676,CULIACAN,,80020,MX
A833 CULIACAN LA CAMPINA,BLVD DR MORA 1725 LOC 6-G,CULIACAN ROSALES,,80060,MX
A750 FORUM CULIACAN,BLVD JOSE DIEGO VALADES 1676 PB07,CULIACAN ROSALES,,80027,MX
0046 L CULIACAN,BLVD. JOSE DIEGO VALADEZ 1676,PONIENTE COL. DESARROLLO URBANO,,80000,MX
"GRUPO MISOCRI, SA DE CV",BLVD. JOSE DIEGO VALADEZ No. 1676,CULIACAN,,80020,MX
B298 SEARS FORUM CULIACAN,BLVD DIEGO VALADEZ RIOS 1676,CULIACAN,,80027,MX
CAMARENA LEDESMA MARCELA DE LOS,BLVD SINALOA No. 716 A,CULIACAN,,80060,MX
A978 CULIACAN CENTRO,AV. ANTONIO ROSALES 216,CULIACAN ROSALES,,80000,MX
ALMANZA CASTILLO ARTURO RAFAEL,HIDALGO ORIENTE No. 181,CULIACAN,,80000,MX
EM: OPERADORA PARA LAS MEJORES OPT,ESCOBEDO No. 258,CULIACAN,,80000,MX
BARRON MONTES JESUS OLIVIA,MARIANO ESCOBEDO OTE  No. 234,CULIACAN,,80000,MX
CASTRO ROMO FLERIDA DRUCILA,CRISTOBAL COLON PTE No. 274,CULIACAN,,80000,MX
PERDOMO SIERRA MICHELLE MARIANA,AQUILES SERDAN 63 SUR,"COL CENTRO, CULIACAN",,80000,MX
A723 CULIACAN PLAZA FIESTA,AV INSURGENTES Y L. CARDENAS SN,CULIACAN ROSALES,,80200,MX
B933 CIMACO CULIACAN,BLVD PEDRO INFANTE 3000,CULIACAN,,80100,MX
B287 SEARS CULIACAN,BLVD ALVARO OBREGON SUR 1980,CULIACAN,,80228,MX
B484 WALMART MEXICO 68 CULIACAN,AV GENERAL ALVARO OBREGON 2891,CULIACAN,,80227,MX
B871 EXPLANADA CULIACAN,BLVD JESUS KUMATE R 5388,CULIACAN,,80104,MX
B794 DEVLYN PLAZA BARRANCOS,AV ALMA SHILLER DE Z 4320,CULIACAN,,80189,MX
B030 GUAMUCHIL PLAZA EVORA,BLVD ANTONIO ROSALES SN LOC 12,SALVADOR ALVARDO GUAMUCHIL,,81460,MX
B243 SORIANA LAS ROSAS,BLVD MIGUEL ALEMAN 1060,GOMEZ PALACIO,,35000,MX
PEREZ MORALES ELIZABETH,CALZ. MANUEL GOMEZ MORIN 609,TORREON,,27276,MX
OLVERA DEL MORAL MARIA YOLANDA,JUAREZ 1822 OTE,TORREON,,27000,MX
"CIA COMERCIAL CIMACO, SA DE CV",AV HIDALGO No. 399 PTE,COL TORREON CENTRO,,27000,MX
NERI MARTINEZ NORMA LETICIA,JUAREZ 246 PONIENTE,TORREON,,27000,MX
"OPTICAS FRANKLIN, S.DE R.L DE C.V.",AV JUAREZ 1534,TORREON,,27000,MX
A958 TORREON CENTRO,AV MORELOS PTE 1184,TORREON,,27000,MX
A618 COPPEL BOULEVARD (MATAMOROS),AV CUAUHTEMOC,MATAMOROS,,27446,MX
B434 TORREON SORIANA,CLZDA DIVISION DEL NORTE  950,TORREON,,27276,MX
EM: SUC. 06 TORREON (TOR) - OPTICAS,AV JUAREZ No. 1534,TORREON,,27000,MX
A739 TORREON PLAZA 4 CAMINOS,BLVD INDEPENDENCIA 1300 LOC 103,TORREON,,27010,MX
B297 TORREON SEARS GALERIAS,PERIF RUAL LOPEZ SANCHEZ 6000,TORREON,,27100,MX
JUAREZ PACHECO ELISEO,BLVD. MIGUEL ALEMAN No. 425 PTE,GOMEZ PALACIO,,35080,MX
A990 GOMEZ PALACIO CENTRO,AV MORELOS NTE 372,GOMEZ PALACIO,,35000,MX
B284 GOMEZ PALACIO SEARS,BLVD MIGUEL ALEMAN S/N,GOMEZ PALACIO,,35080,MX
B243 SORIANA LAS ROSAS,BLVD MIGUEL ALEMAN 1060,GOMEZ PALACIO,,35000,MX
A740 TORREON GALERIAS LA LAGUNA,PERIF RAUL LOPEZ SANCHEZ 6000 L12,TORREON,,27018,MX
A619 COPPEL SAN PEDRO DE LAS COLINA,BLVD TORREON 506,SAN PEDRO,,27800,MX
A619 COPPEL SAN PEDRO DE LAS COLINA,BLVD TORREON 506,SAN PEDRO,,27800,MX
A957 SALTILLO CENTRO,ALLENDE 302,SANTILLO,,25000,MX
SANCHEZ VALDES EDGAR ADRIAN,MOCTEZUMA No. 1860,SALTILLO,,25198,MX
EM: SUC. 16 SALTILLO (SAL) - OPTICA,ALDAMA NUM. 558 PONIENTE,SALTILLO,,25000,MX
A897 SENDERO SALTILLO,CARR LOS GONZALEZ 365,SALTILLO,,25023,MX
OPTICOS Y ACCESORIOS VISUALES,AV UNIVERSIDAD No. 578,SALTILLO,,25260,MX
EM: SUC. 21 SENDERO SALTILLO (SSA),CARR A LOS GONZALEZ 365 LOC 1G,SALTILLO,,25203,MX
A470 CIMACO SALTILLO,CARR. LOS GONZALEZ 365,SALTILLO,,25203,MX
0065 L SALTILLO,BLVD NAZARIO S ORTIZ GARZA 2345,"COL TANQUE DE PENA, SALTILLO",,25279,MX
A779 GALERIAS SALTILLO,BLVD NAZARIO ORTIZ GARZA L-231,SALTILLO,,25260,MX
B787 PLAZOLETA GARCIA,BLVD HERIBERTO CASTILLO MARTINEZ,GARCIA,,66000,MX
A024 ESFERA MONTERREY,"CARR NACIONAL KM 268, LOC A 103",MONTERREY,,64984,MX
A982 PLAZA CADEREYTA,BLVD REVOLUCION 1103 LOC D07,CADEREYTA JIMENEZ,,67480,MX
"BONHAM COMERCIALIZACION, SA DE CV",AV SENDERO SUR No. 214 LOC 3,MONTERREY,,64860,MX
EM: SUC. 22 PLAZA LA SILLA (SIL) -,AV EUGENIO GARZA SADA 3755 SUR,MONTERREY,,64860,MX
A748 PLAZA VALLE ORIENTE,AV LAZARO CARDENAS 1000 LOC 1136,MONTERREY,,64750,MX
1230 MTY NUEVO SUR,AV REVOLUCION 2703 SA-04,MONTERREY,,64830,MX
EM: SUC. 08 ARCADIA (ARC) - OPTICAS,AV. ELOY CAVAZOS 3301 INT. L-23,GUADALUPE,,67170,MX
EM: D'CLASS OPTICA S.A. DE CV,BATALLON DE SAN PATRICIO No. 112,SAN PEDRO GARZA GARCIA,,66278,MX
B446 VETRO PLAZA FIESTA SAN AGUSTIN,AV REAL SAN AGUSTIN 222 LOC 1012,SAN PEDRO GARZA GARCIA,,66260,MX
B280 MTY. SN AGUSTIN SEARS,AV BATALLON DE SAN PATRICIO 1000,SAN PEDRO GARZA GARCIA,,66278,MX
A722 MTY PLAZA FIESTA SAN AGUSTIN,"AV REAL SAN AGUSTIN LOC 1, 2 Y 3",SAN PEDRO GARZA GARCIA,,66260,MX
0045 L MONTERREY VALLE,LAZARO CARDENAS 1000 OTE,COL VALLE ORIENTE,,66260,MX
1045 MONTERREY SAN AGUSTIN,AV. LAZARO CARDENAS No. 314,COL. DEL VALLE,,66259,MX
KHROMA OPTICA SA DE CV,AV GOMEZ MORIN No 300,SAN PEDRO GARZA GARCIA,,66225,MX
B195 OAH PHO NL MONTERREY VASCONCEL,JOSE VASCONCELOS 402,SAN PEDRO GARZA GARCIA,,66220,MX
A761 PASEO SAN PEDRO,JOSE VASCONCELOS 402 LOC 268,SN PEDRO GARZA GARCIA,,66220,MX
FLORES GONZALEZ LUIS ANTONIO,MORELOS No. 101 INT. 110,MONTERREY,,64000,MX
EM: SUC. 39 PADRE MIER (MTY) - OPTI,PADRE MIER NUM 455 OESTE,MONTERREY,,64000,MX
A979 MTY PADRE MIER,PADRE MIER PTE 159,MONTERREY,,64000,MX
B264 MTY. SEARS CENTRO,AV PADRE MIER 143,MONTERREY,,64000,MX
EM: SUC. MONTERREY - OPERADORA,AV. BENITO JUAREZ SUR 123,MONTERREY,,64000,MX
GONZALEZ GARZA BERTHA,JUAN I RAMON OTE 314,MONTERREY,,64000,MX
SALAZAR MARTINEZ NOE,EMILIO CARRANZA No. 122 SUR,MONTERREY,,64000,MX
SERVICIOS Y ASESORIAS LOMA LARGA,AV LA CLINICA 2520 DESP 221,MONTERREY,,64718,MX
A029 PASEO LA FE,AV MIGUEL ALEMAN 200 A-12,SAN NICOLAS DE LOS GARZA,,66470,MX
B436 SORIANA SAN PEDRO,HUMBERTO LOBO 520,SAN PEDRO DE LOS GARZA GARCIA,,66200,MX
A904 MULTIPLAZA LINDAVISTA,AV MIGUEL ALEMAN 5064 LOC 122,GUADALUPE,,67130,MX
B879 PUNTO VALLE MTY,RIO MISSOURI 555 L304,SAN PEDRO GARZA GARCIA,,66220,MX
"OPTICAS PREMIER, S.A. DE C.V.",COLEGIO CIVIL 860 NTE.,MONTERREY,,64000,MX
EM: SUC. 11 CUAUHTEMOC (CUA) -,CUAUHTEMOC NUM. 902 NORTE,MONTERREY,,64000,MX
A994 MTY FAMSA CENTRO,AV CRISTOBAL COLON 601,MONTERREY,,64000,MX
A774 GALERIAS MONTERREY,FELIPE BENAVIDES 2500 LOC 181,MONTERREY,,64620,MX
B304 SEARS MONTERREY,FELIPE BANAVIDES 2500,MONTERREY,,65620,MX
1043 MONTERREY GALERIAS,AV INSURGENTES 2500,COL. VISTA HERMOSA,,64630,MX
B034 CENTRICA MONTERREY,AV VICENTE GUERRERO 2500,MONTERREY,,64550,MX
0031 L MONTERREY GALERIAS,AV. JOSE ELEUTERIO GONZALEZ 550,COL. VISTA HERMOSA MONTERREY,,64620,MX
B307 SEARS STIVA MONTERREY,AV ROMULO GARZA 410,SN NICOLAS DE LOS GARZA,,66470,MX
A893 CITADEL,AV ROMULO GARZA 410 LOC G-06,SAN NICOLAS DE LOS GARZA,,66477,MX
1185 MONTERREY STIVA LA FE,AV. ROMULO GARZA No. 410 SA-1,"COL. LA FE, PZA COMERCIAL CITADEL",,66477,MX
EM: SUC. 40 LINCOLN (LIN) - OPTICAS,AV ABRAHAM LINCOLN 4001 LOC 1-F,MONTERREY,,64346,MX
A598 COPPEL HIDALGO (LINARES),AV DR CARLOS GARCIA RODRIGUEZ 505,LINARES,,67700,MX
A620 COPPEL LINARES,AV HIDALGO 960,LINARES,,67700,MX
A982 PLAZA CADEREYTA,BLVD REVOLUCION 1103 LOC D07,CADEREYTA JIMENEZ,,67480,MX
EM: TAMAYO RODRIGUEZ CLAUDIA,BENITO JUAREZ 538 OTE,VICTORIA,,87000,MX
OPTICAS DE MEXICO CENTRO DE,BENITO JUAREZ No. 538,VICTORIA,,87000,MX
OPTICAS DE MEXICO CENTRO DE,BENITO JUAREZ No. 538,VICTORIA,,87000,MX
EM: TAMAYO RODRIGUEZ CLAUDIA,BENITO JUAREZ 538 OTE,VICTORIA,,87000,MX
A634 COPPEL JUAREZ (MATAMOROS),AV DEL NINO 41,MATAMOROS,,87455,MX
A830 MATAMOROS PLAZA,AV PEDRO CARDENAS LOC 1 Y 2,MATAMOROS,,87390,MX
B175 SENDERO MATAMOROS,AV CONSTITUYENTES 300 LOC 22,MATAMOROS,,87315,MX
A645 COPPEL PATIO MATAMOROS,AV CONSTITUYENTES 300,MATAMOROS,,87348,MX
A553 COPPEL MATAMOROS,AV PEDRO CARDENAS 1901,MATAMOROS,,87390,MX
SAVITRI BADRI MAHARAJ,12225 S W 128TH ST UNIT 104,MIAMI,FL,33186,US
SAVITRI BADRI MAHARAJ,12225 S W 128TH ST UNIT 104,MIAMI,FL,33186,US
ADOLFO TAPIA,8260 SW 43RD TER,MIAMI,FL,33155-4217,US
CARTERS OPTICAL,6703 NW 7TH ST  POS 3179,MIAMI,FL,33126,US
JCA OPTICAL LTD,6703 NW 7TH ST  POS #63488,MIAMI,FL,33126,US
PEARLE VISION JAIRO STACIA,7701 NW 15TH ST STE CW830131,MIAMI,FL,33106,US
VISION EXPRESS CO LTD,9515 NW 13TH ST,DORAL,FL,33172-3048,US
SER CARGO EXPRESS,1634 NW 82ND AVE,MIAMI,FL,33126,US
VISUAL EYES,8401 NW 17TH ST,DORAL,FL,33191,US
FOCUS VISION,8401 NW 17TH ST,DORAL,FL,33126-1005,US
OPTICAL OUTLOOK,8401 NW 17TH ST,MIAMI,FL,33191,US
VISUAL EYES,8401 NW 17TH STREET,MIAMI,FL,33191-1005,US
ADRIANA TINEO,1940 NW 82 AVE,DORAL,FL,33126,US
KLY EYE CARE / YOURAINNE KELLY,1 AEROPOST WAY AUA 8821,MIAMI,FL,33206,US
MORRIS OPTICAL,1 AEROPOST WAY KIN 12095,MIAMI,FL,33206,US
OPTIEK NINON,2000 NW 97TH AVE STE 114,MIAMI,FL,33172,US
LABO VISION,10900 NW 21ST ST UNIT 130,MIAMI,FL,33172,US
WILLIAMS OPTICAL TBXX2556,7801 NW 37TH ST,DORAL,FL,33195,US
RASHMI MATHUR OPTICAL,"TBX9721, 7801 NW 37TH ST",DORAL,FL,33195,US
TRI 284,7801 NW 37TH ST,MIAMI,FL,33166,US
TRANS-EXPRESS VIP SAL 6545,7801 NW 37TH,MIAMI,FL,33166,US
INFINITE EYES,8900 NW 35TH LANE  UNIT 130 STE 952,DORAL,FL,33192,US
COMPASS FREIGHT BROKERS,8900 NW 35TH LN STE 140,DORAL,FL,33172,US
SOCIAL EYES OPTICAL,8900 NW 35TH LANE UNIT 130 STE 9888,MIAMI,FL,33172,US
JCA OPTICAL,10813 NW 30TH ST STE 115 WEB 69265,MIAMI,FL,33192,US
SUMINISTROS OPTICOS DE EL SALVADOR,2200 NW 129TH AVE STE 108,MIAMI,FL,33182,US
KETAN PATEL,10813 NW 30TH ST,MIAMI,FL,33172,US
CONCEPTS IN FREIGHT INC,10814 NW 33RD ST STE 115,MIAMI,FL,33172,US
NORTH SHORE OPTICAL STUDIO LTD,4411 NW 74TH AVE #POS1890,MIAMI,FL,33195,US
INTERPORT LOGISTICS LLC,12950 NW 25TH ST,MIAMI,FL,33182,US
EWD LOGISTICS INC,4829 NW 72 AVE,MIAMI,FL,33166,US
CUR30308,441 N W 74TH AVE,MIAMI,FL,33195,US
SUNVISION GROUP CORP,8340 NW 66TH ST,MIAMI,FL,33166,US
VALUE OPTICAL LTD,570 WEST 20TH ST,HIALEAH,FL,33010-2427,US
VALUE OPTICAL LTD,570 WEST 20TH STREET,HIALEAH,FL,33010-2427,US
F VAN NASSAU,3775 NW 77TH ST,MIAMI,FL,33147,US
OPTIEK 06495 NINON,3775 NW 77TH ST,MIAMI,FL,33147,US
ANNUSHKA ANDREW,7812 N W 71ST ST,MIAMI,FL,33166,US
OPTICA PERFECT VISION,6967 NW 82ND AVE,DORAL,FL,33166,US
PATRICK HEW,7700 NW 79TH PL STE 3,MEDLEY,FL,33166,US
CARIBBEAN OCEAN LOGISTICS,8005 NW 80 ST UNIT 4,MIAMI,FL,33166,US
JOHN BULL LTD,284 BAY ST,NASSAU,,,BS
BAHAMAS VISION CENTRE,PO BOX N 386,NASSAU,,9,BS
FAMILY EYE CARE CENTER,65 COLLINS AVE,NASSAU,,,BS
IMPERIAL OPTICAL CO LTD,ROSETTA ST 32 SIXTH TERRACE,NASSAU,,0,BS
IMPERIAL OPTICAL CO LTD,ROSETTA ST 32 SIXTH TERRACE,NASSAU,,0,BS
JOHN BULL LTD,284 BAY ST,NASSAU,,,BS
FAMILY EYE CARE CENTER,65 COLLINS AVE,NASSAU,,,BS
BAHAMAS VISION CENTRE,PO BOX N 386,NASSAU,,9,BS
SAHARA ARMENDARIZ EDUARDO JAVIER,WENCESLAO LINK S/N L-9,LORETO,,23880,MX
SAHARA ARMENDARIZ EDUARDO JAVIER,WENCESLAO LINK S/N L-9,LORETO,,23880,MX
ROCHA BELTRAN GILBERTO,BENITO JUAREZ No. 338 PTE,AHOME,,81200,MX
B728 SENDERO LOS MOCHIS,BLVD ANTONIO ROSALES 2300 LOC D3,AHOME,,81210,MX
VARELA SARABIA MONICA,RODOLFO T.LOAIZA No. 610-210,AHOME,,81220,MX
MANJARREZ VARELA LINA MARGARITA,SERAPIO RENDON No. 561 PTE.,AHOME,,81200,MX
EM: SUC. PLAZA CIUDAD OBREGON,NO REELECCION No. 826,AHOME,,81200,MX
LEDESMA MELECIO ZARHAEMLA,ALVARO OBREGON PTE No. 1431-A,AHOME,,81245,MX
OPTICA GARCIA S.A.DE C.V,GABRIEL LEYVA No. 198 SUR,AHOME,,81200,MX
B004 LOS MOCHIS CENTRO,AV INDEPENDENCIA 385,AHOME,,81200,MX
ACOSTA NAVARRO ROMINA PAOLA,GABRIEL LEYVA SUR No. 160,AHOME,,81200,MX
B311 SEARS LOS MOCHIS,BLVD CENTENARIO 805 LOC A-2,AHOME,,81271,MX
0305 L LOS MOCHIS,BLVD. CENTENARIO No. 805 PTE,ESQ ANTONIO ROSALES,,81270,MX
A960 LOS MOCHIS PLAZA FIESTA,BLVD ANTONIO ROSALES LOC 1,AHOME LOS MOCHIS,,81200,MX
A905 PASEO LOS MOCHIS,BLVD CENTENARIO 805 LOC A-2,AHOME,,81200,MX
EM: SUC PLAZA LOS MOCHIS -OPERADORA,GUILLERMO PRIETO No. 459 LOCAL B,AHOME,,81200,MX
B882 WALMART GUASAVE,AV PASEO MIGUEL LEYSON PEREZ,GUASAVE,,81020,MX
B493 CASA LEY GUASAVE,AV ARTURO PEIBERT CAMACH SN,GUASAVE,,81040,MX
EM: AHUMADA CHAVEZ CARMEN ZAMIRA,JUAN CARRASCO 461,GUASAVE,,81000,MX
1145 CULIACAN,BLVD. CARLOS SALINAS DE GORTARI,No. 1676 PTE. FRACCIONAMIENTO,,80000,MX
1145 CULIACAN,BLVD. CARLOS SALINAS DE GORTARI,No. 1676 PTE. FRACCIONAMIENTO,,80000,MX
B882 WALMART GUASAVE,AV PASEO MIGUEL LEYSON PEREZ,GUASAVE,,81020,MX
EM: AHUMADA CHAVEZ CARMEN ZAMIRA,JUAN CARRASCO 461,GUASAVE,,81000,MX
B493 CASA LEY GUASAVE,AV ARTURO PEIBERT CAMACH SN,GUASAVE,,81040,MX
B030 GUAMUCHIL PLAZA EVORA,BLVD ANTONIO ROSALES SN LOC 12,SALVADOR ALVARDO GUAMUCHIL,,81460,MX
B728 SENDERO LOS MOCHIS,BLVD ANTONIO ROSALES 2300 LOC D3,AHOME,,81210,MX
A740 TORREON GALERIAS LA LAGUNA,PERIF RAUL LOPEZ SANCHEZ 6000 L12,TORREON,,27018,MX
A619 COPPEL SAN PEDRO DE LAS COLINA,BLVD TORREON 506,SAN PEDRO,,27800,MX
B297 TORREON SEARS GALERIAS,PERIF RUAL LOPEZ SANCHEZ 6000,TORREON,,27100,MX
A739 TORREON PLAZA 4 CAMINOS,BLVD INDEPENDENCIA 1300 LOC 103,TORREON,,27010,MX
EM: SUC. 06 TORREON (TOR) - OPTICAS,AV JUAREZ No. 1534,TORREON,,27000,MX
B284 GOMEZ PALACIO SEARS,BLVD MIGUEL ALEMAN S/N,GOMEZ PALACIO,,35080,MX
A990 GOMEZ PALACIO CENTRO,AV MORELOS NTE 372,GOMEZ PALACIO,,35000,MX
JUAREZ PACHECO ELISEO,BLVD. MIGUEL ALEMAN No. 425 PTE,GOMEZ PALACIO,,35080,MX
B434 TORREON SORIANA,CLZDA DIVISION DEL NORTE  950,TORREON,,27276,MX
B243 SORIANA LAS ROSAS,BLVD MIGUEL ALEMAN 1060,GOMEZ PALACIO,,35000,MX
OLVERA DEL MORAL MARIA YOLANDA,JUAREZ 1822 OTE,TORREON,,27000,MX
NERI MARTINEZ NORMA LETICIA,JUAREZ 246 PONIENTE,TORREON,,27000,MX
A958 TORREON CENTRO,AV MORELOS PTE 1184,TORREON,,27000,MX
A618 COPPEL BOULEVARD (MATAMOROS),AV CUAUHTEMOC,MATAMOROS,,27446,MX
"CIA COMERCIAL CIMACO, SA DE CV",AV HIDALGO No. 399 PTE,COL TORREON CENTRO,,27000,MX
"OPTICAS FRANKLIN, S.DE R.L DE C.V.",AV JUAREZ 1534,TORREON,,27000,MX
PEREZ MORALES ELIZABETH,CALZ. MANUEL GOMEZ MORIN 609,TORREON,,27276,MX
A619 COPPEL SAN PEDRO DE LAS COLINA,BLVD TORREON 506,SAN PEDRO,,27800,MX
B787 PLAZOLETA GARCIA,BLVD HERIBERTO CASTILLO MARTINEZ,GARCIA,,66000,MX
A779 GALERIAS SALTILLO,BLVD NAZARIO ORTIZ GARZA L-231,SALTILLO,,25260,MX
0065 L SALTILLO,BLVD NAZARIO S ORTIZ GARZA 2345,"COL TANQUE DE PENA, SALTILLO",,25279,MX
EM: SUC. 21 SENDERO SALTILLO (SSA),CARR A LOS GONZALEZ 365 LOC 1G,SALTILLO,,25203,MX
A470 CIMACO SALTILLO,CARR. LOS GONZALEZ 365,SALTILLO,,25203,MX
OPTICOS Y ACCESORIOS VISUALES,AV UNIVERSIDAD No. 578,SALTILLO,,25260,MX
A897 SENDERO SALTILLO,CARR LOS GONZALEZ 365,SALTILLO,,25023,MX
EM: SUC. 16 SALTILLO (SAL) - OPTICA,ALDAMA NUM. 558 PONIENTE,SALTILLO,,25000,MX
B042 SENDERO LINCOLN,AV ABRAHAM LINCOLN 4001 LOC 4-D,MONTERREY,,64346,MX
SANCHEZ VALDES EDGAR ADRIAN,MOCTEZUMA No. 1860,SALTILLO,,25198,MX
A957 SALTILLO CENTRO,ALLENDE 302,SANTILLO,,25000,MX
A714 PLAZA CUMBRES,AV HACIENDA PENUELAS 6771,MONTERREY,,64349,MX
A959 MTY HIPERMART,ALEJANDRO DE RODAS 3102 LOC 14-A,MONTERREY,,64610,MX
EM: SUC. 40 LINCOLN (LIN) - OPTICAS,AV ABRAHAM LINCOLN 4001 LOC 1-F,MONTERREY,,64346,MX
B436 SORIANA SAN PEDRO,HUMBERTO LOBO 520,SAN PEDRO DE LOS GARZA GARCIA,,66200,MX
B879 PUNTO VALLE MTY,RIO MISSOURI 555 L304,SAN PEDRO GARZA GARCIA,,66220,MX
0031 L MONTERREY GALERIAS,AV. JOSE ELEUTERIO GONZALEZ 550,COL. VISTA HERMOSA MONTERREY,,64620,MX
1043 MONTERREY GALERIAS,AV INSURGENTES 2500,COL. VISTA HERMOSA,,64630,MX
B304 SEARS MONTERREY,FELIPE BANAVIDES 2500,MONTERREY,,65620,MX
A774 GALERIAS MONTERREY,FELIPE BENAVIDES 2500 LOC 181,MONTERREY,,64620,MX
EM: SUC. 33 SENDERO MTY (SEN) -,AV SENDERO 130 NTE LOC 3 BLOQUE H,GENERAL ESCOBEDO,,66050,MX
B279 MONTERREY SEARS ANAHUAC,AV MANUEL BARRAGAN 325,SAN NICOLAS DE LOS GARZA,,66400,MX
A907 AMPL PLAZA FIESTA ANAHUAC,V MANUEL BARRAGAN 325 1067,SN NICOLAS DE LOS GARZA,,66457,MX
SERVICIOS Y ASESORIAS LOMA LARGA,AV LA CLINICA 2520 DESP 221,MONTERREY,,64718,MX
A761 PASEO SAN PEDRO,JOSE VASCONCELOS 402 LOC 268,SN PEDRO GARZA GARCIA,,66220,MX
B195 OAH PHO NL MONTERREY VASCONCEL,JOSE VASCONCELOS 402,SAN PEDRO GARZA GARCIA,,66220,MX
KHROMA OPTICA SA DE CV,AV GOMEZ MORIN No 300,SAN PEDRO GARZA GARCIA,,66225,MX
1045 MONTERREY SAN AGUSTIN,AV. LAZARO CARDENAS No. 314,COL. DEL VALLE,,66259,MX
0045 L MONTERREY VALLE,LAZARO CARDENAS 1000 OTE,COL VALLE ORIENTE,,66260,MX
A994 MTY FAMSA CENTRO,AV CRISTOBAL COLON 601,MONTERREY,,64000,MX
A722 MTY PLAZA FIESTA SAN AGUSTIN,"AV REAL SAN AGUSTIN LOC 1, 2 Y 3",SAN PEDRO GARZA GARCIA,,66260,MX
B034 CENTRICA MONTERREY,AV VICENTE GUERRERO 2500,MONTERREY,,64550,MX
EM: SUC. 11 CUAUHTEMOC (CUA) -,CUAUHTEMOC NUM. 902 NORTE,MONTERREY,,64000,MX
GONZALEZ GARZA BERTHA,JUAN I RAMON OTE 314,MONTERREY,,64000,MX
A877 PLAZA BELLA HEB SENDERO,AV SENDERO DIVISORIO 1001,GENERAL ESCOBEDO,,66059,MX
B280 MTY. SN AGUSTIN SEARS,AV BATALLON DE SAN PATRICIO 1000,SAN PEDRO GARZA GARCIA,,66278,MX
B446 VETRO PLAZA FIESTA SAN AGUSTIN,AV REAL SAN AGUSTIN 222 LOC 1012,SAN PEDRO GARZA GARCIA,,66260,MX
"OPTICAS PREMIER, S.A. DE C.V.",COLEGIO CIVIL 860 NTE.,MONTERREY,,64000,MX
EM: D'CLASS OPTICA S.A. DE CV,BATALLON DE SAN PATRICIO No. 112,SAN PEDRO GARZA GARCIA,,66278,MX
EM: SUC. 56 SENDERO APODACA (APO) -,AV CONCORDIA 800 LOC F-01,APODACA,,66612,MX
A903 SENDERO APODACA,AV CONCORDIA 800,APODACA,,66612,MX
EM: SUC. 56 SENDERO APODACA (APO) -,AV CONCORDIA 800 LOC F-01,APODACA,,66612,MX
A877 PLAZA BELLA HEB SENDERO,AV SENDERO DIVISORIO 1001,GENERAL ESCOBEDO,,66059,MX
EM: SUC. 33 SENDERO MTY (SEN) -,AV SENDERO 130 NTE LOC 3 BLOQUE H,GENERAL ESCOBEDO,,66050,MX
MASCARENAS HINOJOSA MAURICIO,MONTES URALES No. 1034,SAN NICOLÁS DE LOS GARZA,,66460,MX
EM: SUC. 29 APODACA (PFE) -,CARR. MIGUEL ALEMAN 889 KM18 L1F,APODACA,,66600,MX
1185 MONTERREY STIVA LA FE,AV. ROMULO GARZA No. 410 SA-1,"COL. LA FE, PZA COMERCIAL CITADEL",,66477,MX
A893 CITADEL,AV ROMULO GARZA 410 LOC G-06,SAN NICOLAS DE LOS GARZA,,66477,MX
A907 AMPL PLAZA FIESTA ANAHUAC,V MANUEL BARRAGAN 325 1067,SN NICOLAS DE LOS GARZA,,66457,MX
B279 MONTERREY SEARS ANAHUAC,AV MANUEL BARRAGAN 325,SAN NICOLAS DE LOS GARZA,,66400,MX
B307 SEARS STIVA MONTERREY,AV ROMULO GARZA 410,SN NICOLAS DE LOS GARZA,,66470,MX
B042 SENDERO LINCOLN,AV ABRAHAM LINCOLN 4001 LOC 4-D,MONTERREY,,64346,MX
A904 MULTIPLAZA LINDAVISTA,AV MIGUEL ALEMAN 5064 LOC 122,GUADALUPE,,67130,MX
A029 PASEO LA FE,AV MIGUEL ALEMAN 200 A-12,SAN NICOLAS DE LOS GARZA,,66470,MX
B034 CENTRICA MONTERREY,AV VICENTE GUERRERO 2500,MONTERREY,,64550,MX
EM: SUC. 40 LINCOLN (LIN) - OPTICAS,AV ABRAHAM LINCOLN 4001 LOC 1-F,MONTERREY,,64346,MX
A714 PLAZA CUMBRES,AV HACIENDA PENUELAS 6771,MONTERREY,,64349,MX
A959 MTY HIPERMART,ALEJANDRO DE RODAS 3102 LOC 14-A,MONTERREY,,64610,MX
EM: SUC. MONTERREY - OPERADORA,AV. BENITO JUAREZ SUR 123,MONTERREY,,64000,MX
A994 MTY FAMSA CENTRO,AV CRISTOBAL COLON 601,MONTERREY,,64000,MX
"OPTICAS PREMIER, S.A. DE C.V.",COLEGIO CIVIL 860 NTE.,MONTERREY,,64000,MX
EM: SUC. 11 CUAUHTEMOC (CUA) -,CUAUHTEMOC NUM. 902 NORTE,MONTERREY,,64000,MX
